{
  "schema_version": "1.0.0",
  "evaluation_id": "urn:m5:canon:evaluation:deny-001",
  "timestamp": "2026-10-07T16:00:00Z",
  "principal_ref": "urn:tcid:pseudonymous:principal-002",
  "agent_ref": "urn:m5agt:agent-002",
  "operation": "execute_transfer",
  "resource_ref": "urn:titlechain:asset:example-002",
  "purpose": "execute_scoped_transfer_workflow",
  "jurisdiction_ref": "urn:m5:jurisdiction:us-ca",
  "policy_version": "m5canon-2026-10",
  "authority_record_ref": "urn:m5:authority:record-002",
  "delegation_ref": "urn:m5:delegation:002",
  "gates": {
    "g1_principal_identity": {
      "decision": "pass",
      "evidence_refs": [
        "urn:m5:evidence:identity-002"
      ],
      "reason_code": "PRINCIPAL_RESOLVED"
    },
    "g2_role_credential": {
      "decision": "fail",
      "evidence_refs": [
        "urn:m5:authority:record-002"
      ],
      "reason_code": "CREDENTIAL_EXPIRED"
    },
    "g3_jurisdiction": {
      "decision": "pass",
      "evidence_refs": [
        "urn:m5:jurisdiction:us-ca"
      ],
      "reason_code": "JURISDICTION_RESOLVED"
    },
    "g4_policy": {
      "decision": "fail",
      "evidence_refs": [
        "urn:m5:policy:m5canon-2026-10"
      ],
      "reason_code": "AUTHORITY_PRECONDITION_NOT_SATISFIED"
    },
    "g5_approval": {
      "decision": "fail",
      "evidence_refs": [],
      "reason_code": "APPROVAL_NOT_EVALUATED_AFTER_AUTHORITY_FAILURE"
    },
    "g6_evidence_anchor": {
      "decision": "pass",
      "evidence_refs": [
        "urn:m5:provenance:denial-002"
      ],
      "reason_code": "DENIAL_EVIDENCE_RECORDED"
    }
  },
  "overall_decision": "deny",
  "authorization_receipt_ref": "urn:m5:receipt:authorization-deny-002",
  "provenance_refs": [
    "urn:m5:provenance:denial-002"
  ]
}
